{
  "$schema": "https://json-schema.org/draft/2020-12/schema",
  "$id": "https://dc-farmer.example/schema/event.json",
  "title": "Event",
  "type": "object",
  "required": ["id", "title", "date", "location", "type"],
  "properties": {
    "id": { "type": "string", "pattern": "^[a-z0-9-]+$" },
    "title": { "type": "string", "minLength": 3, "maxLength": 120 },
    "date": { "type": "string", "format": "date" },
    "startTime": {
      "type": "string",
      "pattern": "^([0-1]?[0-9]|2[0-3]):[0-5][0-9]$"
    },
    "endTime": {
      "type": "string",
      "pattern": "^([0-1]?[0-9]|2[0-3]):[0-5][0-9]$"
    },
    "location": { "type": "string", "minLength": 2, "maxLength": 120 },
    "description": { "type": "string", "maxLength": 500 },
    "type": {
      "type": "string",
      "enum": [
        "Training",
        "Meisterschaftsspiel",
        "Turnier",
        "Hauptversammlung",
        "Social"
      ]
    },
    "teamIds": {
      "type": "array",
      "items": { "type": "string", "pattern": "^[a-z0-9-]+$" },
      "uniqueItems": true
    },
    "cancelled": { "type": "boolean", "default": false }
  },
  "additionalProperties": false
}
