[
  {
    "id": "event-2025-12-05-dc-farmer-tournament",
    "title": "DC Farmer Clubturnier Dezember 2025",
    "date": "2025-12-05",
    "startTime": "19:30",
    "endTime": "23:30",
    "location": "DC Farmer Clublokal",
    "description": "Monatliches Clubturnier für alle Interessierten. Preise für die Top 3!",
    "type": "Turnier",
    "teamIds": ["steeldarts"],
    "cancelled": false
  },
  {
    "id": "event-2025-12-06-league-match",
    "title": "DC Farmer vs. Casa Benfica GE",
    "date": "2025-12-06",
    "startTime": "13:00",
    "location": "DC Farmer Clublokal",
    "description": "1. Liga Meisterschaftsspiel gegen Casa Benfica GE.",
    "type": "Meisterschaftsspiel",
    "teamIds": ["steeldarts"],
    "cancelled": false
  }
]
